<lecture xmlns:xsi="http://www.w3.org/2001/XMLSchema-instance"
         xsi:noNamespaceSchemaLocation="lecture.xsd">
    <name>Visual Analytics</name>
    <semester>SS2025</semester>
    <course>IF</course>
    <lecturer id="1234">
        <first-name>Yannick</first-name>
        <last-name>Weber</last-name>
    </lecturer>

    <books>
        <book>
            <title>The Visual Display of Quantitative Information</title>
            <author>E. Tufte</author>
            <year>2001</year>
            <isbn>1930824130</isbn>
        </book>
    </books>

    <classes>
        <class id="1">
            <date>2025-01-01</date>
        </class>
        <class id="2">
            <date>2025-01-08</date>
        </class>
    </classes>
</lecture>
